{
  "name": "rfc2865-access-accept-class",
  "rfc": "RFC2865",
  "description": "Access-Accept packet with a single Class attribute used as a deterministic protocol vector.",
  "packetHex": "02 01 00 1e 00 00 00 00 00 00 00 00 00 00 00 00 00 00 00 00 19 0a 65 6e 67 69 6e 65 65 72",
  "expected": {
    "code": 2,
    "identifier": 1,
    "length": 30,
    "authenticatorHexPattern": "00 00 00 00 00 00 00 00 00 00 00 00 00 00 00 00",
    "attributes": [
      {
        "id": 25,
        "name": "Class",
        "rawHex": "656e67696e656572",
        "decodedValue": "engineer"
      }
    ]
  }
}