{
  "name": "rfc2869-access-request-message-authenticator",
  "rfc": "RFC2869",
  "description": "Access-Request packet with a deterministic non-HMAC 16-byte Message-Authenticator placeholder.",
  "packetHex": "01 11 00 26 00 00 00 00 00 00 00 00 00 00 00 00 00 00 00 00 50 12 4d 41 2d 50 4c 41 43 45 48 4f 4c 44 45 52 30 31",
  "expected": {
    "code": 1,
    "identifier": 17,
    "length": 38,
    "authenticatorHexPattern": "00 00 00 00 00 00 00 00 00 00 00 00 00 00 00 00",
    "attributes": [
      {
        "id": 80,
        "name": "Message-Authenticator",
        "rawHex": "4d412d504c414345484f4c4445523031",
        "decodedValue": "MA-PLACEHOLDER01"
      }
    ]
  }
}
