{
  "name": "rfc2869-accounting-request-event-timestamp",
  "rfc": "RFC2869",
  "description": "Accounting-Request packet with a deterministic Event-Timestamp value.",
  "packetHex": "04 21 00 1a 00 00 00 00 00 00 00 00 00 00 00 00 00 00 00 00 37 06 65 92 00 80",
  "expected": {
    "code": 4,
    "identifier": 33,
    "length": 26,
    "authenticatorHexPattern": "00 00 00 00 00 00 00 00 00 00 00 00 00 00 00 00",
    "attributes": [
      {
        "id": 55,
        "name": "Event-Timestamp",
        "rawHex": "65920080",
        "decodedValue": "2024-01-01T00:00:00.000Z"
      }
    ]
  }
}
