{
  "name": "rfc6929-extended-attribute",
  "rfc": "RFC6929",
  "description": "Access-Accept packet with one extended attribute (Type 241).",
  "packetHex": "02 01 00 1b 00 00 00 00 00 00 00 00 00 00 00 00 00 00 00 00 f1 07 01 de ad be ef",
  "expected": {
    "code": 2,
    "identifier": 1,
    "length": 27,
    "authenticatorHexPattern": "00 00 00 00 00 00 00 00 00 00 00 00 00 00 00 00",
    "attributes": [
      {
        "id": 241,
        "name": "Extended-Attribute-241",
        "rawHex": "01deadbeef",
        "decodedValue": {
          "format": "extended",
          "extendedType": 1,
          "data": "deadbeef"
        }
      }
    ]
  }
}
