{
  "name": "rfc2869-access-request-eap-message",
  "rfc": "RFC2869",
  "description": "Access-Request packet carrying a minimal EAP Request Identity payload with a deterministic Message-Authenticator placeholder.",
  "packetHex": "01 10 00 2d 00 00 00 00 00 00 00 00 00 00 00 00 00 00 00 00 4f 07 01 00 00 05 01 50 12 00 00 00 00 00 00 00 00 00 00 00 00 00 00 00 00",
  "expected": {
    "code": 1,
    "identifier": 16,
    "length": 45,
    "authenticatorHexPattern": "00 00 00 00 00 00 00 00 00 00 00 00 00 00 00 00",
    "attributes": [
      {
        "id": 79,
        "name": "EAP-Message",
        "rawHex": "0100000501",
        "decodedValue": "\u0001\u0000\u0000\u0005\u0001"
      },
      {
        "id": 80,
        "name": "Message-Authenticator",
        "rawHex": "00000000000000000000000000000000",
        "decodedValue": "\u0000\u0000\u0000\u0000\u0000\u0000\u0000\u0000\u0000\u0000\u0000\u0000\u0000\u0000\u0000\u0000"
      }
    ]
  }
}
